{
  "$schema": "../packages/schema/json-schemas/registry.json",
  "baseUrl": "https://raw.githubusercontent.com/favorodera/distkit/refs/tags/v0.0.1-alpha.0/",
  "dependencies": {
    "npmPackages": {
      "ofetch": "^1.5.1"
    },
    "utilities": [
      "styling"
    ]
  },
  "items": [
    {
      "$schema": "../../schema/json-schemas/component.json",
      "name": "button",
      "type": "component",
      "files": [
        "packages/ui/src/components/button/button.vue",
        "packages/ui/src/components/button/index.ts"
      ]
    },
    {
      "$schema": "../../schema/json-schemas/utility.json",
      "name": "props",
      "type": "utility",
      "files": [
        "packages/ui/src/utils/props.ts"
      ]
    }
  ],
  "name": "distkit",
  "version": "0.0.1-alpha.0"
}
